{
  "schemaId": "dnp:user:v1.json",
  "schemaVersion": 1,
  "dataVersion": 0,
  "data": {
    "username": "zihao",
    "age": 99,
    "description": "8b384716-dba7-47cb-9d35-503462b384716-dba7-47cb-9d35-503462ab1fac8b384716-dba7-47cb-9d35-503462ab1fac8b384716-dba7-47cb-9d35-503462ab1fac8b384716-dba7-47cb-9d35-503462ab1fac8b384716-dba7-47cb-9d35-503462ab1fac8b384716-dba7-47cb-9d35-503462ab1fac8b384716-dba7-47cb-9d35-503462ab1fac8b384716-dba7-47cb-9d35-503462ab1fac",
    "university": "school2",
    "company": "tracelink",
    "address": {
      "country": "US",
      "state": "MA",
      "city": "Boston"
    },
    "birthday": {
      "year": 2020,
      "month": 1,
      "day": 1
    },
    "phones": [
      {
        "phoneNumberType": "cell",
        "phoneNumberValue": "123-456-7890"
      },
      {
        "phoneNumberType": "home",
        "phoneNumberValue": "234-5678-901"
      }
    ],
    "hobbies": [
      "basketball",
      "ski"
    ]
  }
}